"titulo","empresa","ubicacion","salario","descripcion","url"
"Desarrollador Full Stack - React y React Native","GRUPO TRUPER","Miguel Hidalgo, Ciudad de México DF","$ 7,428","En GRUPO TRUPER estamos en búsqueda de un Desarrollador Full Stack con experiencia sólida en React, Vuejs, React Native y Nodejs, para integrarse a nuestro equipo de tecnología. Si te apasiona el desarrollo web y móvil, y estás buscando nuevos retos en una empresa innovadora y en constante crecimiento, ¡esta oportunidad es para ti!Requisitos del puestoAl menos 4 años de experiencia como desarrollador full stack.Licenciatura concluida en Ingeniería en Sistemas, Informática, Computación o afín (mínimo 100% de créditos comprobables).Dominio de Reactjs y Vuejs para desarrollo frontend.Experiencia en React Native para desarrollo móvil.Conocimiento sólido en Nodejs para backend.Conocimientos deseables en Java.Manejo de APIs RESTful.Bases de datos relacionales y no relacionales (MySQL, MongoDB, etc.).Control de versiones con Git.Conocimiento de metodologías ágiles (Scrum, Kanban).Conocimiento de herramientas de integración continua y buenas prácticas de desarrollo.Responsabilidades del puestoDesarrollar aplicaciones web y móviles escalables, eficientes y de alto rendimiento.Diseñar e implementar funcionalidades tanto del lado cliente como del lado servidor.Integrar servicios de terceros y APIs RESTful.Participar en decisiones técnicas, arquitectónicas y de diseño.Colaborar con equipos multidisciplinarios para garantizar entregables de calidad.Realizar mantenimiento, mejoras y soporte a soluciones existentes.Participar en revisiones de código y documentación técnica.BeneficiosSueldo base competitivoPrestaciones de leyPrestaciones superiores a la leyEstabilidad laboralOportunidades de desarrollo profesional en un entorno de innovación constante","https://mx.computrabajo.com/ofertas-de-trabajo/oferta-de-trabajo-de-desarrollador-full-stack-react-y-react-native-en-miguel-hidalgo-4A265DDFE2BCD22B61373E686DCF3405#lc=ListOffers-Score3-0"
"Desarrollador/a - Node.js y react","Blackcore ®","León, Guanajuato","$ 20,000.00","Sobre la empresa:Blackcore es una compañía líder en tecnología para el sector inmobiliario, ofreciendo soluciones SaaS innovadoras para la gestión del proceso de crédito inmobiliario. Contamos con presencia en México y LATAM, ayudando al sector bancario, unidades de valuación, despachos y agentes a optimizar sus procesos. Buscamos un perfil apasionado por desarrollar nuevas herramientas y aplicaciones para mejorar la vida del usuario.HABILIDADES Y ACTITUDES:- Gusto por el trabajo en equipo.- Trabajo bajo presión.- Proactivo.- Autodidacta.- Actitud de servicio.- Orientado a resultados.EXPERIENCIA LABORAL-Experiencia comprobable desarrollando las actividades y habilidades del puesto y/o similares.- Diseño responsivo y desarrollo.- Consumo de Web Services y API’s.FORMACIÓN ACADÉMICA:- Licenciatura, especialidad o superior. Matemáticas aplicadas y computación, Matemáticas, Actuaría, sistemas o afín.RESPONSABILIDADES DEL PUESTO:- Analizar y desarrollar nuevas funciones/aplicaciones para el usuario y negocio.- Optimización constante de código y consultas.- Proponer, innovar y actualizarse en nuevas tecnologías de desarrollo.- Documentar todo lo relacionado a los proyectos y API's.- Definir nuevas funcionalidades para el usuario y negocio.- Aterrizar peticiones y dar seguimiento a incidencias y entregas.- Dar seguimiento a resolución de errores y funcionalidades.- Mejorar la calidad y la satisfacción de los clientes.- Definir y aplicar las mejores prácticas en la calidad del software.CONOCIMIENTOS:- NODE. JS- REACT- MongoDB y MySQL- RESTful API usando Postman- Diseño responsivo: Móvil, Escritorio, Tableta- HTML5- CSS- Javascript- Control de versionamiento (Git)-React Native-PostgreSQL-Diseño responsivo- JSOTROS REQUISITOS:- Inglés básico.- PHP Deseable.- VUEJS Deseable.- Frameworks (Codeigniter, Laravel o similares) Deseable.OFRECEMOS:- $20,000 mensuales bruto (A convenir según experiencia y competencias)- Prestaciones de Ley- Vales de Despensa- Excelente ambiente laboral-Oportunidad de aprendizaje y crecimiento en una empresa en plena expansión en LATAM.-Acceso a capacitaciones y certificaciones especializadas (AWS).-Cultura de innovación y tecnología en el sector inmobiliario y bancario.-Estabilidad laboral y ambiente profesional.-Capacitación y desarrollo constante.La vacante es 100% Presencial ¡Postúlate y únete al equipo de Blackcore!","https://mx.computrabajo.com/ofertas-de-trabajo/oferta-de-trabajo-de-desarrolladora-nodejs-y-react-en-leon-66B71D6A0EE09EAD61373E686DCF3405#lc=ListOffers-Score3-1"
"Desarrollador/a FullStack","Holcim Apasco","San Pedro Tlaquepaque, Jalisco","$ 20,000.00","¿QUIÉN ES HOLCIM?Somos el líder mundial en soluciones innovadoras y sostenibles para la construcción mediante cuatro segmentos de negocio: cemento, concreto/hormigón premezclado, agregados, soluciones y productos.Nuestro objetivo es impulsar la construcción circular para construir más con menos. Gracias a nuestro enfoque en la reducción de emisiones de CO2, cuidado al medio ambiente, apoyo a las comunidades y desarrollo de nuestra gente, hemos logrado que nuestros 70.000 colaboradores y colaboradoras en todo el mundo sienten una gran pasión por construir progreso para las personas y el planeta, creando mejores soluciones y experiencias para sus clientes, comunidades y equipos.¡TRABAJA CON NOSOTROS!Tendrás la oportunidad de compartir la pasión que tenemos por nuestro planeta, aportar perspectivas innovadoras, dentro de un entorno dinámico y retador, que promueve la diversidad e inclusión.Porque solo si trabajamos juntos en una cultura en la que todos prosperamos, podremos construir el mundo en el que todos queremos vivir.TE ESTAMOS BUSCANDO: Desarrollador/a FullStack!Serás responsable de diseñar, desarrollar y mantener aplicaciones web completas (frontend y backend), asegurando interfaces atractivas, usabilidad, seguridad y alto rendimiento.Tus principales retos serán:Crear interfaces de usuario modernas, responsivas y funcionales.Desarrollar APIs robustas e integraciones con servicios externos.Implementar y administrar bases de datos relacionales y no relacionales.Asegurar la autenticación y seguridad de las aplicaciones.Integrar plataformas de pago y otros servicios de terceros.Colaborar con equipos multidisciplinarios en entornos ágiles.Lugar de trabajo: Carretera a Tlaquepaque Jalisco, San Martin de las flores.Requisitos indispensables:Licenciatura o ingeniería en sistemas, desarrollo de software o afín.Experiencia comprobable en desarrollo Full Stack.Dominio de HTML, CSS, JavaScript y frameworks como React, Angular o VuejsConocimientos en backend con Nodejs, Python o Java.Manejo de bases de datos relacionales (SQL Server, PostgreSQL) y no relacionales (MongoDB, Firebase).Experiencia con integración de APIs REST y GraphQL.Uso de servicios en la nube (AWS, GCP) y control de versiones con Git/GitHub.Inglés B2.Requisitos deseados:Experiencia en entornos de retail, e commerce o mayoristas (B2B/B2C).Familiaridad con plataformas de pago.Conocimientos en backend con Nodejs, Python o Java.¡NO TE PIERDAS LA OPORTUNIDAD DE SER PARTE DE NUESTRO EQUIPO!¡CONSTRUYE PROGRESO CON NOSOTROS!","https://mx.computrabajo.com/ofertas-de-trabajo/oferta-de-trabajo-de-desarrolladora-fullstack-en-san-pedro-tlaquepaque-7B5D20BFE204246961373E686DCF3405#lc=ListOffers-Score3-2"
"Programador/a - Temporal","Caja Morelia Valladolid","Morelia, Michoacán","$ 7,209","Empresa Mexicana dedicada al servicio Financiero con 59 años de historia y presencia nacional, Caja Morelia Valladolid solicita personal.PROGRAMADOR TEMPORALOFECEMOS:-Sueldo base.-Prestaciones superiores a las de Ley.-Vales de despensa 8% del sueldo bruto mensual.-Fondo de ahorro del 13% del sueldo bruto mensual.-Seguro de vida.-Prima vacacional 100%.-30 días de aguinaldo desde el primer año.-Uniformes.-Opciones a becas.- Y mucho más...REQUISITOS:•Licenciatura o ingeniería Titulado en Informática, Sistemas Computacionales, TIC’s a fines.•Dominio de bases de datos SQL SERVER•Dominio de .NET C# o JAVA•Dominio Programación web (Html5, Maquetado CSS, Javascript, ECMAScript 2015+, VueJS2)•Dominio API Rest y SOAP (Net Core, nodeJS)•Dominio Programación móvil (Android, IOS, híbrido o nativo)•Manejo de Control de Versiones GIT.•Manejo de Plataforma JIRA & Confluence•Deseable Delphi 6Horario de trabajo: Lunes a Viernes de 8:30 am a 5 pm y Sábados de 8:30 am a 2 pmInteresados postularse por este medio","https://mx.computrabajo.com/ofertas-de-trabajo/oferta-de-trabajo-de-programadora-temporal-en-morelia-DA3519AF994F093961373E686DCF3405#lc=ListOffers-Score0-3"
"Work From Home Shopify Engineer / Ref. 0176","BairesDev LLC","Aguascalientes, Aguascalientes","$ 3,700","At BairesDev®, weve been leading the way in technology projects for over 15 years. We deliver cutting-edge solutions to giants like Google and the most innovative startups in Silicon Valley.Our diverse 4,000+ team, composed of the worlds Top 1% of tech talent, works remotely on roles that drive significant impact worldwide.When you apply for this position, youre taking the first step in a process that goes beyond the ordinary. We aim to align your passions and skills with our vacancies, setting you on a path to exceptional career development and success.Shopify Engineer at BairesDevWe are looking for a Shopify Engineer to join our Development team and help the client take its eCommerce platform to the next level. The Shopify Engineer will be responsible for designing, developing, and maintaining the clients Shopify website and integrations with other systems. This is an excellent opportunity for those professionals looking to develop in one of the fastest-growing companies in the industry!What You Will Do:- Collaborate with the eCommerce team to understand business requirements and translate them into technical solutions.- Design and implement custom Shopify themes and templates.- Build and maintain custom Shopify apps and plugins.- Integrate Shopify with other systems such as CRM, ERP, and payment gateways.- Ensure website performance and security are optimized.- Troubleshoot and resolve website issues.Heres what we are looking for:- 3+ years of experience with Shopify Liquid.- 2+ years of experience with a JS Framework (React, NextJS, VueJS, etc).- Proven track record in Shopify App development.- Shopify headless architecture experience (stores/apps) is desirable, but not mandatory.- Upper English level.How we do make your work (and your life) easier:- 100% remote work (from anywhere).- Excellent compensation in USD or your local currency if preferred- Hardware and software setup for you to work from home.- Flexible hours: create your own schedule.- Paid parental leaves, vacations, and national holidays.- Innovative and multicultural work environment: collaborate and learn from the global Top 1% of talent.- Supportive environment with mentorship, promotions, skill development, and diverse growth opportunities.Apply now and become part of a global team where your unique talents can truly thrive!","https://mx.computrabajo.com/ofertas-de-trabajo/oferta-de-trabajo-de-work-from-home-shopify-engineer-ref-0176-en-aguascalientes-E73911D6D1CFC2E461373E686DCF3405#lc=ListOffers-Score0-4"
"Trabajo Desde Casa Ingeniero Vue.js / Ref. 0255","BairesDev LLC","Miguel Hidalgo, Ciudad de México DF","$ 3,700","En BairesDev® llevamos 15 años liderando proyectos de tecnología para clientes como Google, Rolls-Royce y las startups más innovadoras de Silicon Valley. Actualmente, contamos con un equipo de 4000 profesionales conformado por el top 1% de la industria trabajando de forma remota desde más de 50 países.Al postularte a esta vacante, estarás dando el primer paso en un proceso que va más allá de lo convencional: Buscaremos conocer en profundidad tus habilidades, intereses y expectativas con el objetivo de realizar una búsqueda personalizada y encontrar el rol ideal para ti en BairesDev.Ingeniero Vue.js en BairesDevBuscamos Ingenieros de Vue.js para unirse a nuestro equipo de Desarrollo y participar en diferentes proyectos conformados por equipos multiculturales distribuidos por todo el mundo. Buscamos personas proactivas, jugadores de equipo apasionados por la programación en este lenguaje y orientados a brindar la mejor experiencia al usuario final.Principales responsabilidades:- Desarrollar aplicaciones de interfaz utilizando Vue.js y el ecosistema circundante.- Traducir con precisión las necesidades de los usuarios y las empresas en un código de interfaz funcional.- Desarrollar y probar IU para escritorio y sitios web receptivos.- Implementar pruebas automatizadas integradas en los flujos de trabajo de desarrollo y mantenimiento.- Crear códigos y bibliotecas reutilizables para uso futuro.- Estar actualizado con todos los desarrollos recientes en el espacio JavaScript y Vue.js.- Estar centrado en las actualizaciones de seguridad y los problemas encontrados con Vue.js y todas las dependencias del proyecto.- Realizar actualizaciones y mejoras necesarias para mantenerse al día con las mejores prácticas modernas de seguridad y desarrollo.- Contribuir con ideas e innovaciones, siempre que vea una oportunidad de mejora.- Trabajar en colaboración con nuestros equipos multidisciplinares.¿Qué Buscamos?:- 5+ años de experiencia en desarrollo de software.- 3+ años de experiencia con el desarrollo de Vue.Js.- Fuertes habilidades con el lenguaje JavaScript y frameworks (React, Angular, Ember, etc.).- Experta o avanzada experiencia en tecnologías front-end, arquitecturas de seguridad y experiencia de usuario.- Avanzado en el desarrollo y prueba de aplicaciones web basadas en web, basadas en web móvil y totalmente receptivas utilizando marcos de JavaScript como Jest, Mocha, Chai, Jasmine, etc.- Experiencia en integraciones de servicios (servicios web, sistemas CMS / Commerce, API de terceros, etc.).- Experiencia tanto en el consumo como en el diseño de API RESTful.- Nivel de inglés avanzado.Qué ofrecemos para que tu trabajo (y tu vida) sea más fácil:- Trabajo 100% remoto: trabaja desde tu casa o donde quieras.- Compensación en USD o en tu moneda local, como prefieras, muy por encima de la media del mercado.- Hardware y software.- Horarios flexibles- Licencias por mater/paternidad, vacaciones y días festivos nacionales pagos.- Ambiente laboral multicultural e innovador, perfecto para hacer amigos, colaborar y aprender de las personas más talentosas del mundo.- Oportunidades de crecimiento y desarrollo profesional a través de mentorías y entrenamientos.¡Únete a nuestro equipo global!","https://mx.computrabajo.com/ofertas-de-trabajo/oferta-de-trabajo-de-trabajo-desde-casa-ingeniero-vuejs-ref-0255-en-miguel-hidalgo-E3BED11D4FCF3A2B61373E686DCF3405#lc=ListOffers-Score0-5"
"Trabajo Desde Casa Desarrollador de Vue.js / Ref. 0255","BairesDev LLC","Benito Juárez, Quintana Roo","$ 3,700","En BairesDev® llevamos 15 años liderando proyectos de tecnología para clientes como Google, Rolls-Royce y las startups más innovadoras de Silicon Valley. Actualmente, contamos con un equipo de 4000 profesionales conformado por el top 1% de la industria trabajando de forma remota desde más de 50 países.Al postularte a esta vacante, estarás dando el primer paso en un proceso que va más allá de lo convencional: Buscaremos conocer en profundidad tus habilidades, intereses y expectativas con el objetivo de realizar una búsqueda personalizada y encontrar el rol ideal para ti en BairesDev.Desarrollador de Vue.js en BairesDevBuscamos Desarrollador de Vue.js para unirse a nuestro equipo de Desarrollo y participar en diferentes proyectos conformados por equipos multiculturales distribuidos por todo el mundo. Buscamos personas proactivas, jugadores de equipo apasionados por la programación en este lenguaje y orientados a brindar la mejor experiencia al usuario final.Actividades principales:- Desarrollar aplicaciones de interfaz utilizando Vue.js y el ecosistema circundante.- Traducir con precisión las necesidades de los usuarios y las empresas en un código de interfaz funcional.- Desarrollar y probar IU para escritorio y sitios web receptivos.- Implementar pruebas automatizadas integradas en los flujos de trabajo de desarrollo y mantenimiento.- Crear códigos y bibliotecas reutilizables para uso futuro.- Estar actualizado con todos los desarrollos recientes en el espacio JavaScript y Vue.js.- Estar centrado en las actualizaciones de seguridad y los problemas encontrados con Vue.js y todas las dependencias del proyecto.- Realizar actualizaciones y mejoras necesarias para mantenerse al día con las mejores prácticas modernas de seguridad y desarrollo.- Contribuir con ideas e innovaciones, siempre que vea una oportunidad de mejora.- Trabajar en colaboración con nuestros equipos multidisciplinares.¿Qué Buscamos?:- 5+ años de experiencia en desarrollo de software.- 3+ años de experiencia con el desarrollo de Vue.Js.- Fuertes habilidades con el lenguaje JavaScript y frameworks (React, Angular, Ember, etc.).- Experta o avanzada experiencia en tecnologías front-end, arquitecturas de seguridad y experiencia de usuario.- Avanzado en el desarrollo y prueba de aplicaciones web basadas en web, basadas en web móvil y totalmente receptivas utilizando marcos de JavaScript como Jest, Mocha, Chai, Jasmine, etc.- Experiencia en integraciones de servicios (servicios web, sistemas CMS / Commerce, API de terceros, etc.).- Experiencia tanto en el consumo como en el diseño de API RESTful.- Nivel de inglés avanzado.Qué ofrecemos para que tu trabajo (y tu vida) sea más fácil:- Trabajo 100% remoto: trabaja desde tu casa o donde quieras.- Compensación en USD o en tu moneda local, como prefieras, muy por encima de la media del mercado.- Hardware y software.- Horarios flexibles- Licencias por mater/paternidad, vacaciones y días festivos nacionales pagos.- Ambiente laboral multicultural e innovador, perfecto para hacer amigos, colaborar y aprender de las personas más talentosas del mundo.- Oportunidades de crecimiento y desarrollo profesional a través de mentorías y entrenamientos.¡Únete a nuestro equipo global!","https://mx.computrabajo.com/ofertas-de-trabajo/oferta-de-trabajo-de-trabajo-desde-casa-desarrollador-de-vuejs-ref-0255-en-benito-juarez-9F90675E3FE4BB6B61373E686DCF3405#lc=ListOffers-Score0-6"
"Programador/a - Temporal","Caja Morelia Valladolid","Morelia, Michoacán","$ 7,209","Empresa Mexicana dedicada al servicio Financiero con 59 años de historia y presencia nacional, Caja Morelia Valladolid solicita personal.PROGRAMADOR TEMPORALOFECEMOS:-Sueldo base.-Prestaciones superiores a las de Ley.-Vales de despensa 8% del sueldo bruto mensual.-Fondo de ahorro del 13% del sueldo bruto mensual.-Seguro de vida.-Prima vacacional 100%.-30 días de aguinaldo desde el primer año.-Uniformes.-Opciones a becas.- Y mucho más...REQUISITOS:•Licenciatura o ingeniería Titulado en Informática, Sistemas Computacionales, TIC’s a fines.•Dominio de bases de datos SQL SERVER•Dominio de .NET C# o JAVA•Dominio Programación web (Html5, Maquetado CSS, Javascript, ECMAScript 2015+, VueJS2)•Dominio API Rest y SOAP (Net Core, nodeJS)•Dominio Programación móvil (Android, IOS, híbrido o nativo)•Manejo de Control de Versiones GIT.•Manejo de Plataforma JIRA & Confluence•Deseable Delphi 6Horario de trabajo: Lunes a Viernes de 8:30 am a 5 pm y Sábados de 8:30 am a 2 pmInteresados postularse por este medio","https://mx.computrabajo.com/ofertas-de-trabajo/oferta-de-trabajo-de-programadora-temporal-en-morelia-4B58ECD317F4993161373E686DCF3405#lc=ListOffers-Score0-7"